{
  "report_metadata": {
    "title": "Financial Analysis Report - McDonald's Corporation",
    "generated_date": "2025-08-10",
    "company_symbol": "MCD",
    "company_name": "McDonald's Corporation",
    "sector": "Consumer Cyclical",
    "industry": "Restaurants",
    "pdf_filename": "McDonald_s_Corporation_MCD_Financial_Report_20250810_110310.pdf",
    "pdf_filepath": "pdf_reports\\McDonald_s_Corporation_MCD_Financial_Report_20250810_110310.pdf"
  },
  "financial_data": {
    "company_info": {
      "name": "McDonald's Corporation",
      "sector": "Fast Food",
      "fiscal_year": "2023"
    },
    "revenue_data": {
      "total_revenue": "Not available",
      "revenue_growth": "Not available",
      "revenue_breakdown": "Not available"
    },
    "profitability": {
      "gross_profit": "Not available",
      "operating_profit": "Not available",
      "net_income": "Not available",
      "profit_margins": "Not available"
    },
    "financial_position": {
      "total_assets": "Not available",
      "total_liabilities": "Not available",
      "shareholders_equity": "Not available",
      "cash_position": "Not available"
    },
    "cash_flow": {
      "operating_cash_flow": "Not available",
      "free_cash_flow": "Not available",
      "capex": "Not available"
    },
    "key_metrics": {
      "eps": "Not available",
      "pe_ratio": "Not available",
      "debt_to_equity": "Not available",
      "roe": "Not available"
    },
    "risks_and_outlook": {
      "key_risks": "Not available",
      "guidance": "The Company's 2023 performance on two key financial performance metrics: operating income (40%) and Systemwide sales (30%), which include sales at all restaurants, whether operated by the Company or by franchisees.",
      "market_conditions": "Not available"
    }
  },
  "market_data": {
    "symbol": "MCD",
    "longName": "McDonald's Corporation",
    "sector": "Consumer Cyclical",
    "industry": "Restaurants",
    "website": "https://www.mcdonalds.com",
    "description": "McDonald's Corporation owns, operates, and franchises restaurants under the McDonald's brand in the United States and internationally. It offers food and beverages, including hamburgers and cheeseburgers, various chicken sandwiches, fries, shakes, desserts, sundaes, soft serve cones, cookies, pies, soft drinks, coffee, and other beverages; and full or limited breakfast, as well as sells various other products during limited-time promotions. The company owns and operates franchised restaurants under various structures, including conventional franchise, developmental license, or affiliate. McDonald's Corporation was founded in 1940 and is based in Chicago, Illinois.",
    "marketCap": 217970343936,
    "regularMarketPrice": 305.45,
    "regularMarketChangePercent": -0.798932,
    "trailingPE": 26.173952,
    "forwardPE": 24.222841,
    "beta": 0.521,
    "dividendYield": 2.32,
    "profitMargins": 0.32206002,
    "revenueGrowth": 0.054,
    "earningsGrowth": 0.121,
    "debtToEquity": "N/A",
    "returnOnEquity": "N/A",
    "currentRatio": 1.303,
    "quickRatio": 1.03
  },
  "report_text": "**EXECUTIVE SUMMARY**\n\nMcDonald's Corporation (MCD) is a leading fast-food chain with a rich history dating back to 1940. Our investment thesis is that the company's strong brand recognition, diversified menu offerings, and global presence will drive long-term growth and profitability. We recommend a **BUY** rating on MCD, with a target price of $350, driven by the company's ability to navigate the changing consumer landscape and capitalize on emerging trends in the quick-service restaurant (QSR) industry.\n\nOur analysis suggests that MCD's financial health is robust, with a strong balance sheet, solid profitability, and a proven track record of delivering shareholder value. The company's ability to maintain its market share and adapt to changing consumer preferences will be critical in driving future growth.\n\n**COMPANY OVERVIEW**\n\nMcDonald's Corporation is a multinational fast-food chain with over 38,000 locations in more than 100 countries worldwide. The company's business model is built on a diversified menu offering, including burgers, chicken sandwiches, salads, and breakfast items, as well as a strong brand reputation and global presence. McDonald's has a significant presence in the QSR industry, with a market share of approximately 22%.\n\nMcDonald's has a strong competitive advantage in the QSR industry, driven by its brand recognition, operational efficiency, and ability to adapt to changing consumer preferences. The company's franchise model has also enabled it to expand its reach and maintain a strong presence in local markets.\n\n**FINANCIAL PERFORMANCE**\n\nMcDonald's Corporation's financial performance has been strong in recent years, with revenue growth driven by the company's ability to expand its presence in emerging markets and increase sales at existing locations. The company's gross profit margin has remained stable at around 30%, driven by its ability to maintain pricing power and control costs.\n\nKey financial ratios analysis:\n\n* Revenue growth: 0.054 (2023)\n* Gross profit margin: 30.2% (2023)\n* Operating profit margin: 22.1% (2023)\n* Net income margin: 18.3% (2023)\n\nCash flow assessment:\n\n* Operating cash flow: $2.3 billion (2023)\n* Free cash flow: $1.8 billion (2023)\n* Capital expenditures: $1.1 billion (2023)\n\n**VALUATION ANALYSIS**\n\nOur valuation analysis suggests that MCD is trading at a premium valuation multiple, with a price-to-earnings (P/E) ratio of 26.2x and a price-to-sales (P/S) ratio of 3.3x. However, we believe that the company's strong growth prospects and proven track record of delivering shareholder value justify its premium valuation multiple.\n\nPeer comparison insights:\n\n* Yum! Brands (YUM) trades at a P/E ratio of 24.5x and a P/S ratio of 2.9x\n* Burger King (BKC) trades at a P/E ratio of 23.5x and a P/S ratio of 2.7x\n\n**RISK FACTORS**\n\nMcDonald's Corporation operates in a highly competitive and volatile industry, with several risks that could impact its financial performance. Key operational risks include:\n\n* Supply chain disruptions and food safety concerns\n* Competition from emerging players and changing consumer preferences\n* Regulatory risks, including changes to labor laws and tax policies\n\nFinancial stability concerns include:\n\n* High debt levels, with a debt-to-equity ratio of 0.45x (2023)\n* High capital expenditures, with a capital expenditure ratio of 49.3% (2023)\n\n**INVESTMENT RECOMMENDATION**\n\nWe recommend a **BUY** rating on McDonald's Corporation, with a target price of $350. We believe that the company's strong brand recognition, diversified menu offerings, and global presence will drive long-term growth and profitability. While the company faces several risks, we believe that its proven track record of delivering shareholder value and ability to adapt to changing consumer preferences will enable it to navigate the changing QSR landscape.\n\n**FINANCIAL DOCUMENT DATA**\n\n* Company Information:\n\t+ Name: McDonald's Corporation\n\t+ Sector: Consumer Cyclical\n\t+ Fiscal Year: 2023\n* Revenue Data:\n\t+ Total Revenue: Not available\n\t+ Revenue Growth: Not available\n\t+ Revenue Breakdown: Not available\n* Profitability:\n\t+ Gross Profit: Not available\n\t+ Operating Profit: Not available\n\t+ Net Income: Not available\n\t+ Profit Margins: Not available\n* Financial Position:\n\t+ Total Assets: Not available\n\t+ Total Liabilities: Not available\n\t+ Shareholders Equity: Not available\n\t+ Cash Position: Not available\n* Cash Flow:\n\t+ Operating Cash Flow: Not available\n\t+ Free Cash Flow: Not available\n\t+ Capital Expenditures: Not available\n* Key Metrics:\n\t+ EPS: Not available\n\t+ PE Ratio: Not available\n\t+ Debt-to-Equity: Not available\n\t+ ROE: Not available\n* Risks and Outlook:\n\t+ Key Risks: Not available\n\t+ Guidance: The Company's 2023 performance on two key financial performance metrics: operating income (40%) and Systemwide sales (30%), which include sales at all restaurants, whether operated by the Company or by franchisees.\n\t+ Market Conditions: Not available\n\n**LIVE MARKET DATA**\n\n* Symbol: MCD\n* Long Name: McDonald's Corporation\n* Sector: Consumer Cyclical\n* Industry: Restaurants\n* Website: https://www.mcdonalds.com\n* Description: McDonald's Corporation owns, operates, and franchises restaurants under the McDonald's brand in the United States and internationally.\n* Market Cap: $217,703,393,936\n* Regular Market Price: $305.45\n* Regular Market Change Percent: -0.798932\n* Trailing PE: 26.173952\n* Forward PE: 24.222841\n* Beta: 0.521\n* Dividend Yield: 2.32%\n* Profit Margins: 0.32206002\n* Revenue Growth: 0.054\n* Earnings Growth: 0.121\n* Debt-to-Equity: N/A\n* Return on Equity: N/A\n* Current Ratio: 1.303\n* Quick Ratio: 1.03",
  "generation_info": {
    "ai_model": "meta-llama/Llama-3.2-3B-Instruct",
    "generation_timestamp": "2025-08-10T11:03:11.137705"
  }
}