{
  "filename": "MGMRESORTS_2023_8K_dated-2023-09-12.pdf",
  "extraction_result": {
    "financial_data": {
      "company_info": {
        "name": "MGM Resorts International",
        "sector": "Entertainment",
        "fiscal_year": "2023"
      },
      "revenue_data": {
        "total_revenue": null,
        "revenue_growth": null,
        "revenue_breakdown": null
      },
      "profitability": {
        "gross_profit": null,
        "operating_profit": null,
        "net_income": null,
        "profit_margins": null
      },
      "financial_position": {
        "total_assets": null,
        "total_liabilities": null,
        "shareholders_equity": null,
        "cash_position": null
      },
      "cash_flow": {
        "operating_cash_flow": null,
        "free_cash_flow": null,
        "capex": null
      },
      "key_metrics": {
        "eps": null,
        "pe_ratio": null,
        "debt_to_equity": null,
        "roe": null
      },
      "risks_and_outlook": {
        "key_risks": "Cybersecurity incident",
        "guidance": "Ongoing investigation and implementation of measures to secure business operations",
        "market_conditions": null
      }
    },
    "extraction_success": true,
    "raw_model_output": "Here is the comprehensive JSON with the extracted financial information:\n\n```\n{\n  \"company_info\": {\n    \"name\": \"MGM Resorts International\",\n    \"sector\": \"Entertainment\",\n    \"fiscal_year\": \"2023\"\n  },\n  \"revenue_data\": {\n    \"total_revenue\": null,\n    \"revenue_growth\": null,\n    \"revenue_breakdown\": null\n  },\n  \"profitability\": {\n    \"gross_profit\": null,\n    \"operating_profit\": null,\n    \"net_income\": null,\n    \"profit_margins\": null\n  },\n  \"financial_position\": {\n    \"total_assets\": null,\n    \"total_liabilities\": null,\n    \"shareholders_equity\": null,\n    \"cash_position\": null\n  },\n  \"cash_flow\": {\n    \"operating_cash_flow\": null,\n    \"free_cash_flow\": null,\n    \"capex\": null\n  },\n  \"key_metrics\": {\n    \"eps\": null,\n    \"pe_ratio\": null,\n    \"debt_to_equity\": null,\n    \"roe\": null\n  },\n  \"risks_and_outlook\": {\n    \"key_risks\": \"Cybersecurity incident\",\n    \"guidance\": \"Ongoing investigation and implementation of measures to secure business operations\",\n    \"market_conditions\": null\n  }\n}\n```\n\nNote that most of the financial information is not available in the document, so the corresponding fields are set to `null`."
  },
  "text_length": 8543
}